{
  "id": "dev-32p-128c",
  "name": "Dev 32 producers × 128 consumers (32KB payload, 128MB ring, 1–8ms/item)",
  "producers": {
    "count": 32,
    "rate_min": 120,
    "rate_max": 180,
    "payload_bytes_min": 32768,
    "payload_bytes_max": 32768,
    "batch_mode": true,
    "flush_timeout_ms": 100,
    "outbound_max_mb": 128,
    "reconnect_delay_secs": 2,
    "duration_secs": 3600
  },
  "consumers": {
    "count": 128,
    "max_batch_size_count": 32,
    "simulate_process_ms": true,
    "process_ms_min": 1,
    "process_ms_max": 8,
    "prefetch_batch_count": 4,
    "batch_timeout_secs": 12,
    "data_idle_secs": 60,
    "reconnect_delay_secs": 2,
    "log_every": 100
  }
}
